,context,question,answerA,answerB,answerC,correct
1170,Quinn was trying out for the team and hoped they would get chosen.,Why did Quinn do this?,wanted to be on the team,do their best,try to impress others,A
1171,Cameron kissed them on the cheek after they had won the match against their fiercest rival yet.,How would Others feel as a result?,surprised at the public display of affection between them,annoyed that they made the victory about their feelings,jealous that they were not the ones kissed instead,A
1172,Casey taught Cameron the way to walk home from school alone.,What will Casey and Cameron want to do next?,talk about looking out suspicious people,drive to school instead of walk,talk about all the mean dogs along the way,A
1173,I told Addison a secret and Addison told my friend.,How would Others feel as a result?,betrayed by Addison,happy with Addison,a back-stabber,A
1174,Skylar rushed to where Aubrey feel and held her head.,What will happen to Skylar?,go to the hospital,get bandaged up,a sense of fear,C
1175,"Quinn had gotten some fancy new deodorant at the store, so Quinn smelled nice today.",Why did Quinn do this?,improve their personal odor,use deodorant everyday to keep smelling good,ask the new girl out because he smells good,A
1176,Aubrey gave Taylor a new designer watch for Christmas one year.,How would Aubrey feel afterwards?,giving,upset,happy to be able to financially afford more expensive gifts for Taylor,C
1177,Casey was a cow that lived on the farm. Casey chewed the cud.,How would you describe Casey?,full of food,large,hairy,A
1178,Quinn looked as if he has lost a shilling and found sixpence and then went to the cafe to get lunch.,How would Quinn feel afterwards?,hungry,lazy,proud,C
1179,Tracy can't believe Bailey's luck as Bailey won the big lottery for a huge prize.,What will happen to Bailey?,be much richer,become jealous,be without any funds,A
1180,Alex wanted to sit by a window and was moving when he spilt Riley's coffee.,What does Alex need to do before this?,take his time,pick up some salt and pepper,move faster,C
1181,Riley ate it quickly because she needed to get to work in an hour.,Why did Riley do this?,go to work,lazy,full,A
1182,Tracy practice singing for the recital next week.,Why did Tracy do this?,invites friends,make improvement,be a good singer,C
1183,Aubrey bought some new clothes.  Aubrey changed her socks frequently as she changed outfits.,What will Aubrey want to do next?,loved new things,wanted to match her socks and clothes,change outfits,C
1184,Kai was feeling anxious and needed to calm down. Kai put together the puzzle.,Why did Kai do this?,become anxious by the puzzle,think about why they hate activities,think about something else,C
1185,Skylar held Aubrey's hand gently in theirs during the date.,What will happen to Aubrey?,blush brightly,love them,hate them,A
1186,Riley saw the video online and got a good chuckle or two from it.,How would you describe Riley?,feeling conflicted,feeling great,feeling bored,B
1187,Carson wanted to leave the store because he had other things to do.,How would you describe Carson?,occupied,lazy,arrogant,A
1188,Riley had to take care of Tracy by going to the store and getting their favorite soup.,What does Riley need to do before this?,know how to get to the store,find out their own favorite soup,Eat some soup,A
1189,Sasha tried a new restaurant every Friday night with her friends.,How would you describe Sasha?,adverse to change,no longer hungry,spontaneous,C
1190,Riley overslept by 2 hours. Riley arrived at their destination late.,How would you describe Riley?,a person that arrived at the right time,bad,not on time,C
1191,Kendall had their teeth pulled out at the dentist.,Why did Kendall do this?,have a dentist,get their teeth replaced,have silver teeth,B
1192,"Jan knew she didn't have the time or energy for a dog, but bought one anyway.",How would Jan feel afterwards?,very happy,very remorseful,impulsive,C
1193,Ash thanked Aubrey's father profusely when they said they could have a party.,What will Ash want to do next?,have lots of fun,throw a party,ask about a party,B
1194,Riley wanted to be poor so he had Carson give all of his money away.,Why did Riley do this?,be charitable,hate people,not have any money,C
1195,Tracy included another dollar in her payment to the food delivery person.,What will the food delivery person want to do next?,Thank Tracy for the extra dollar,thank the food delivery person,eat her food,A
1196,Robin told Bailey they wanted to have them over for their Christmas party that year.,How would you describe Robin?,excited because all the popular people attend Robin's parties,giving,Excited to purchase a new dress for the occasion,A
1197,Bailey was sitting on the floor but got to his feet.,What will Bailey want to do next?,go to bed,stretch,press against the floor,B
1198,"Remy carried the bag into the enemy's country, then hid in plain site as they reached their destination.",What does Remy need to do before this?,be good at blending tea,be good at blending in,conceal herself,B
1199,Riley held a demonstration and increased the awareness of women's rights.,What will Riley want to do next?,strong,proud,hope it helps,C
1200,Bob thought Quinn would be an easy opponet. But Quinn slammed dunked the basketball.,How would Bob feel as a result?,surprised at Quinn's skill,pleased with the game,indifferent to what happened,A
1201,Taylor's graduation took place during the worst years of their life when their parents died.,What will Taylor want to do next?,celebrate their graduation,remember her parents,leave school,B
1202,Robin went rock climbing and had fun climbing rocks.,How would you describe Robin?,As someone who had fun,As someone who teaches to climb,As someone that talks about fun,A
1203,Kai told Carson that he must be of royal ancestry and was going to inherit a lot of money.,What will happen to Carson?,get in trouble for decieving Carson,sad,excited,C
1204,Carson reduced Robin's dependence on the alcohol by taking her to scheduled AA meetings.,What will Carson want to do next?,go to a bar,make sure that he's available to Robing for help,find a new friend,B
1205,Quinn had trouble falling asleep and had to stay up and watch some shows.,What will Quinn want to do next?,drink coffee,better,get in bed,C
1206,Robin met Jan for dinner and after dinner Robin said she forgot her wallet at home and asked Jan to pay for the dinner.,What will happen to Jan?,have less money,be granted her request,have to pay for the cab,A
1207,"Jan had done many things for Bailey and always with nothing in return, so Jan did not owe Bailey any favors.",What will Bailey want to do next?,be less helpful,do Jan a favor,not do any favors,B
1208,Aubrey worked hard at school and got straight A's on all of her assignments.,What does Aubrey need to do before this?,play video games,read,sleep,B
1209,"Ash was trying to move the car, but something was prevented him from doing so.",How would you describe Ash?,done right,very angry,forgets to check things,C
1210,Alex practiced their instrument with their friend and wanted to join the band.,How would Alex feel afterwards?,boring,musical,accomplished,B
1211,Lee opposed every suggestion that the group put out which made everyone furious.,What will others want to do next?,hear the group out,argue with Lee,listen to the suggestions,B
1212,"She thought she was being humorous and the life of the party, but Addison looked like a fool.",How would you describe Addison?,socially awkward,classy,refined,A
1213,Sydney is a hairstylist who has been working at a salon for years.,What does Sydney need to do before this?,get a hair cut,get an appointment,needed to be trained,C
1214,Ash and Kai are fighting. Casey is friends with both and doesn't want to choose.,What will happen to Casey?,ignore Ash,listen to each side before choosing,be stuck in the middle of a friends fight,C
1215,"Not wanting to see their friend damage their reputation any more, Alex acted on Ash's anger and pulled them aside.",Why did Alex do this?,tell Ash to stop the drama,help Ash calm down,poke fun at Ash's struggle,B
1216,Jesse bought a new house and it needed a lot of work done.,How would Jesse feel afterwards?,crabby and dissatisfied,like he should go boating,happy to have it complete,A
1217,"Every time Remy saw a pretty girl, Remy blushed, stuttered and turned away.",How would you describe Remy?,afraid,sorry they embarrassed Remy,bashful,C
1218,"Lee put everything on layaway. The week before Christmas, Lee got everything out of layaway.",What does Lee need to do before this?,bring things home,needed to pay for their products,needed to rent a truck,B
1219,Riley was going out of town for the weekend and needed someone to watch their dog.,How would Cameron feel as a result?,pressed for time,upset,trusted,C
1220,Carson told his teacher he had never been in a play buy would love the chance to try.,What does Carson need to do before this?,be a professional before this,have not been in play before this,have experience before this,B
1221,Robin looked like someone from their recent past.,How would Robin feel afterwards?,serene,was familiar,confused,B
1222,Remy turned Sasha's life around by giving her a good job that paid well.,What will happen to Remy?,be hated,make a lot of money,be thanked,C
1223,"Without bothering to check the condition of the expensive jacket first,Tracy bought what Quinn had to sell, no questions asked.",What will happen to Tracy?,good,wear the jacket to a party,try to mend the jacket,B
1224,Jordan wanted a job that paid well so he could save money to buy a house.,What will Jordan want to do next?,call Jordan's references,apply for jobs,enroll in classes,B
1225,Austin repelled it by force by punching the man in the gut.,How would Austin feel afterwards?,passive,lazy,strong,C
1226,Kai was watching the man order the last of the pizza that was on the tray.,What does Kai need to do before this?,see if there was more pizza,fight the man for the pizza,skip lunch if he couldn't have pizza,A
1227,Casey didn't know what to say so Jesse made Casey's argument.,What will Casey want to do next?,Ask Jan to leave,Thank Jan for helping,do her homework,B
1228,Riley really wanted to get a car after passing their test but their parents did not have much money so Riley decided to get a part time job and save money themselves.,Why did Riley do this?,be able to have their own ride,received permission from their parents to apply for a job,sell their car,A
1229,ash did not want to let anyone in so she prevented the door from moving.,What will Others want to do next?,jam the door closed,find something to block the door,hate ash,C
1230,"Sydney just started a new job and wanted to do well, so she worked hard at it.",Why did Sydney do this?,didn't care about her boss,wanted to be promoted by her boss,go to work,B
1231,Robin had been friends with their neighbor for years talked with them all the time.,What does Robin need to do before this?,of had friends for years,of known them for years,think about talking to them,B
1232,Cameron was a tyrant who would not let the others have a say in the system.,What will happen to Others?,enjoy not having any rights,be happy to not vote,defy Cameron's orders,C
1233,Robin was a fortune teller in the building. Robin determined one's fortune when they came to her.,What does Robin need to do before this?,tell people's fortunes,needed to be psychic,needed to have a metal ball,B
1234,"Bailey was planning on walking the dog, but unexpectedly had to go in to work.",What does Bailey need to do before this?,Ignore any and all phone calls,Fill the dog's food bowl,wanted to keep their Christmas bonus,B
1235,Bailey came over again to console their friend whose mother had died.,How would Bailey feel afterwards?,happy,friendly,empathetic,C
1236,Sasha passed the test easily after studying a lot that week.,What will Others want to do next?,tell them they did well,finish studying on time,make sure she finished the paper,B
1237,Jordan was a regular at Casey's restaurant. Jordan always tipped very well.,How would Casey feel as a result?,thankful for him,like a nice man,well off,A
1238,Sasha had an amazing time going to the gym and working out with her friends.,What will Others want to do next?,indifferent,strong,go home and take a long bath,C
1239,Bailey came again and took everything from their parent's fridge.,How would you describe Bailey?,full,only interested in themselves,a very selfless person,B
1240,"Riley saved every penny, but lost it all during a home invasion.",What will Riley want to do next?,contact the plumber,contact the police,work long hours,B
1241,Casey bought one for Tracy which made his girlfriend extremely jealous.,What will happen to Casey?,be thankful,break up with his girlfriend,argue with Tracy,B
1242,"Quinn had been drinking, so Austin grabbed Quinn's car keys.",What will Austin want to do next?,hold on to the car keys,let Quinn drive home,argue with Austin,A
1243,Taylor prevented people from entering while they prepared the room for the party.,How would Others feel as a result?,upset they missed the party,anxious to be let in,excited for the party,B
1244,alex was bored so he visited his mother's friend.,What does Alex need to do before this?,relieve his boredom,be willing to drive,want to stay home,B
1245,"Kendall gave Aubrey a new job opportunity, which turned Aubrey's life around.",Why did Kendall do this?,continue to work hard,change Aubrey's life,thank Kendall,B
1246,"Riley increased women's rights awareness, and the female candidate won the following election.",What will Others want to do next?,wanted to be educate the public,join Riley in pushing women's rights even further,oppose Riley and caress women,B
1247,Quinn entered a raffle for a cool new sports car and hoped he would get it.,What will Quinn want to do next?,have a bad experience with it,start entering in more raffles,excited about it if he wins,B
1248,Casey dropped groceries off at home before going somewhere else. Their mother had to make dinner.,What does Casey need to do before this?,leave the grocery list,bring the grocery list,leave the house,B
1249,Quinn saw Robin's brother and waved as he walked over.,What will Quinn want to do next?,run away next,chat next,wave,B
1250,Alex asked their sister if they could hang out together today.,How would Alex feel afterwards?,Unsure,a good sibling,Hopeful,C
1251,Tracy went shopping today and ended up spending too much money.,How would Tracy feel afterwards?,someone who enjoys shopping,buyers remorse,someone who doesn't stick to a budget,B
1252,Jesse takes her purse with her everywhere she goes. She does not like being without it.,How would Jesse feel afterwards?,indifferent about leaving it behind,careful,upset she does not have her purse with her,B
1253,She had to do her last semester at sea before heading back home.,What will Jan want to do next?,build a boat,find a way back to sea,continue her career,C
1254,"Cameron had always been a cautious camper, among all the regular stuff he added heat socks.",What does Cameron need to do before this?,show off his heat socks,put away his things from the last trip,let his mom know he's going camping,C
1255,Sydney had a dinner party last week and invited all her closest friends and family.,Why did Sydney do this?,cook a large supper for everyone,serve a large supper for everyone,wanted to see loved ones,C
1256,"Taylor didn't put in any effort on their test, so they got a F on it.",How would you describe Taylor?,a good student,regretful afterwards,failing,B
1257,Casey's mom wanted money to buy a car. Casey sent home some money.,How would Casey feel afterwards?,a respectable person,responsible,someone who cares for his mom,C
1258,Jesse also believed in Carson and helped him get his business off the ground.,What will Jesse want to do next?,be thanked next,go swimming next,believe in Carson,A
1259,Remy put Kai's head down on the table after she fell asleep in her high chair while eating.,How would you describe Remy?,attentive,like a good mother,neglectful,B
1260,Tracy took off their coat because they were getting very impatient with the host for not asking to take their coat.,How would you describe Tracy?,snobby,humble,kind,A
1261,Alex kept up with the growth of their hair to keep it tamed.,What does Alex need to do before this?,brush their hair,get a haircut,get a haircut,A
1262,Tracy went and bought the cookies Quinn was selling at their bakery.,What will happen to Quinn?,are asked about their day,have to bake more cookies,she will like them,B
1263,Aubrey saw every person and mournfully greeted them at the funeral that rainy evening.,How would Aubrey feel afterwards?,invigorated and wet,mournful and depressed,grieving,B
1264,"Depending on how long and hard Robin studied, he determined his own grade.",How would you describe Robin?,a forgetful student,proud,a hardworking student,C
1265,Carson told his teacher never to interrupt her in the middle of a speech.,Why did Carson do this?,understood,lazy,finish speaking,C
1266,Sasha left the scene at the party to go home and rest.,How would Sasha feel afterwards?,tired,Like they need some rest,sleepy,A
1267,Tracey was as good as they get but she still practiced her singing every day.,How would you describe Tracy?,that she stuck to her routine well,didn't care very much about singing,was a passionate person,C
1268,Addison closed the store that day and missed out on a lot of business.,How would Addison feel afterwards?,regretful afterwards,unfortunate,happy afterwards,A
1269,Kendall went to the store to buy some food for herself.,How would Kendall feel afterwards?,ready to make food,boring,scared,A
1270,Taylor ran some errands and brought some groceries back to her home.,What does Taylor need to do before this?,get in the car,rent some skis,buy some muffins,A
1271,Lee committed murder with Austin in their heart because Austin was hrurt.,What will Lee want to do next?,call the police,hide the body,kill the competitor,B
1272,Lee spent hours studying but got bored easily.,What will Lee want to do next?,get some rest,did not like the subject,not sleep,A
1273,Alex visited the town where his mother was born when he finished school.,What will Alex want to do next?,learn about his history,find some relatives,blow up the town,B
1274,Ash had some dinner that was left over from their job. Ash brought dinner to Addison's house.,How would Addison feel as a result?,kind,like having the dinner,like going on a fast,B
1275,Skylar bought milk the other day but it already smells really bad.,What does Skylar need to do before this?,live without having milk,let it be moldy in the refrigerator,throw it away from the refrigerator,B
1276,Addison's friends wanted to pirate the summer blockbuster. Addison insisted they pay for it instead.,How would Addison's friends feel as a result?,earnest,honest,annoyed,C
1277,Alex visited their mother's friend who was terminally ill and didn't have much time left.,What will Alex want to do next?,buy some flowers,say goodbye,go to the hospital,B
1278,Tracy bought Quinn's item and they both enjoyed the important exchange.,What will Tracy want to do next?,wanted to be fair,loved,lazy,A
1279,"Taylor didn't know her tooth was missing, so Carson brought attention to Taylor's mouth.",How would you describe Carson?,would be self conscious,would be excited for the tooth fairy,observant,C
1280,Kendall left Jan high and dry at the altar on the day of their wedding and Jan was killed the next day.,How would Kendall feel afterwards?,happy,horrified,very cowardly when it comes to confronting an issue,B
1281,Kendall left Jan high and dry at the playground when the other kids showed up and Jan played with them.,Why did Kendall do this?,join the kids in the playground,enjoy playing in the playground,be alone,C
1282,Aubrey put on Bailey's hat in a playful fashion that day.,How would Bailey feel as a result?,like she had her hat,like a comedian,hatless,C
1283,Skylar shared the money equally between the people that had participated.,What will Others want to do after this?,be gracious,be upset,be angry,A
1284,Jesse finally completed all of her classes and had finally learned how to surf properly.,What will Jesse want to do next?,practice surfing on the beach with the biggest waves,find surfing lessons,try to apply what they have learned out on the beach,C
1285,Kendall travelled across the country to visit his friends and family in his home town.,How would Kendall feel afterwards?,relaxed,angry,sad,A
1286,Alex told Bailey's daughter about the hayride in the park.,How would Bailey feel as a result?,very fearful,anticipating,like not going,B
1287,Carson was at their grandmother's old house for the entire summer.,What will Carson want to do next?,spend time with their grandmother,go home,renovate the old house,A
1288,Bailey spent time at Alex's house and they had a cooking party.,What will Bailey want to do next?,go home,ignore Alex,be friends with Alex,A
1289,Tracy kicked off Ashe's shoes so they could start getting busy.,What will Ash want to do next?,relax in bed,take off their socks,stop everything and eat,B
1290,Kai lost a weird bet with Austin. Kai licked Austin's balls.,What will Kai want to do next?,walk around naked,put on their pants,he liked balls,B
1291,"Alex had a message to give Bailey, so Alex told Bailey's daughter.",What will Bailey want to do next?,ask their daughter for the message,follow up on Bailey's message,ignore their daughter's message,A
1292,"Taylor played dodgeball at school, and really enjoyed hitting other kids with the balls.",What does Taylor need to do before this?,get a ball and pop it,show up at school,take all his frustration out on the sport,B
1293,Kendall took a long time sitting down because they recently broke their hip and had surgery.,How would Kendall feel afterwards?,happy,unharmed,pained,C
1294,Ash smelled something sweet in the kitchen when she got home from work.,How would Ash feel afterwards?,angry because she's on a diet,hungry for sweet treats,sick because she had a stomach ache,B
1295,Addison looked like a fool after they tripped and fell down the stairs.,What does Addison need to do before this?,embarrass themselves,trip,brush herself off,B
1296,Quinn put on exspensive cologn so that he woulod smell nice today.,What will Others want to do next?,Plug their nose,Get sick,Wear the same brand,C
1297,Aubrey needed to make sure their house was clean before guests arrived. They started cleaning early.,What will Aubrey want to do next?,look proper,sweep the floors,change the oil,B
1298,"Riley knew Camerons sister since preschool, Riley asked her to the prom.",How would Riley feel afterwards?,excited about his sister going to prom,resentment,excited,C
1299,Jan tried to shorten the amount of time she had to stay at rehab.,What does Jan need to do before this?,bake a cake,go to a dance,drink a lot,C
1300,Addison called in sick the next day and their co-workers would have to pick up the slack.,What will happen to the co-workers?,go to the doctor,get angry at Addison,sleep more,B
1301,Cameron thought the accident would happen again but it didn't.,What does Cameron need to do before this?,Avoid the accident,pay attention,sleep,A
1302,"Casey was sick in bed for a whole week, and Casey´s garden was awful. Skylar watered Casey's garden.",Why did Skylar do this?,reward Skylar for taking care of their garden,do something nice with Casey,work on  his garden,B
1303,It was a cold night camping with friends so Sasha started a campfire.,What will Sasha want to do next?,get her friends,sit down by the fire,warm up by the fire,C
1304,"After breaking their leg, Addison couldn't play, so Addison sat and watched everyone.",How would Addison feel afterwards?,thrilled,mean,lonely,C
1305,Bailey forgot her wallet at home so she had to drive all the way to the house.,How would Bailey feel afterwards?,happy that she went for a ride,careless because she forgot her wallet,excited to waste gas,B
1306,Austin directed traffic away from the bike tour in town.,What does Austin need to do before this?,of gone to work,make sure that the bikers make it through the tour safely,wish the bikers a nice time on their ride,B
1307,Robin blew this popsicle stand when he didn't see his friends.,What will Robin want to do next?,search for friends,leave the area,start a riot,A
1308,"Because Jordan was not a creative person, Jordan formed Addison's opinion as their own and took the whole credit.",What will happen to Jordan?,be found out cheating,be very angry with Jordan,miss out on credit,A
1309,Skylar ran out of milk for her cereal so she got milk from the store.,How would you describe Skylar?,regretful,hungry,glad to have milk for breakfast,B
1310,Tracy loved Remy's dog so much that she took care of it.,What will Remy want to do next?,get another pet,spend time with Remy's dog,show their affection for Remy's dog,A
1311,Robin saw something new every day and shared it with everyone.,What will happen to Others?,be ignored,become well liked,be informed,C
1312,Lee started looking at beachfront properties and he moved to Florida.,Why did Lee do this?,research skin cancer by getting repeated sunburns on florida beaches,start a new job as a near the beach,retire in Florida,C
1313,Riley and Lee sat on the sofa as they watched a scary movie.,What will Lee want to do next?,hug Riley's arm,make popcorn,turn on the TV,B
1314,Riley told Carson to give him the knife when Carson was threatening him.,Why did Riley do this?,save a life,hug Carson,kill Carson,A
1315,Robin gave the children candy even though they had already.,How would you describe Robin?,indulgent,generous afterwards,uncaring,A
1316,Quinn went to school for a long time and became a doctor.,What does Quinn need to do before this?,get bad grades in college,wanted to pursue career goal,get good grades in school,C
