,context,question,answerA,answerB,answerC,correct
1616,"Jordan promised to help, so Bailey kissed her on the cheek.",What will happen to Jordan?,both happy and embarrassed,and Riley will never talk to each other again,get help from Jordan and finish the task,A
1617,Kendall and Sasha exchanged numbers so they could study together for the final exam.,What will Kendall want to do next?,study alone,brush up on their notes,do better on the test,B
1618,A woman looked at Kendall. Kendall did not notice it but it was intense. Lee looked at Kendall like that woman did.,Why did Lee do this?,great,in awe,find out why that woman was looking at Kendall,C
1619,Sasha was a world-class chess player and beat her opponent easily.,How would her opponent feel?,an ambitious person,sad,very talented,B
1620,Taylor was having trouble holding the spoon to eat. Carson bought the spoon to Taylor's mouth.,How would Taylor feel as a result?,unhappy they could eat,angry with Carson,thankful to Carson,C
1621,Casey showed them schematically in the figure how the wiring worked.,How would Others feel as a result?,belittled,a good electrician,Informed,C
1622,tracy needed to look at carson so she craned to see his neck.,What will happen to Carson?,a pain in her neck as she sees carson's,jut out past the obstruction to see part of carson,he will question tracy,C
1623,Lee sold a tv on craigslist. He didn't want to sell it but had bills piling up.,Why did Lee do this?,sell the tv,be responsible,be a gift,B
1624,Ash started training.  They were just accepted to join their school's basketball team.,How would you describe Ash?,felt succesful,a person who has a lot of energy,felt proud,B
1625,Sasha met Kendall's customers at the conference and made some deprecating remarks to them.,How would you describe Sasha?,mean,apologetic afterwards,regretful afterwards,A
1626,"Casey told her employee, Dana, she is not getting enough done at work.",How would Casey feel afterwards?,getting done,getting done,relieved Jon will work on the papers,C
1627,Sydney is very attracted to Cameron and decided to slip him the tongue.,What will Cameron want to do next?,kiss him,Act shocked,hug him,B
1628,Quinn is fluent in english only. Their new co worker only speaks spanish. Quinn doesn't not know any Spanish. Quinn decideds to take spanish lessons.,How would Quinn feel afterwards?,upset they have to learn new language,angry their works speaks spanish,out of place in class,C
1629,Casey shed light on the true nature of her ex boyfriend after he began stalking her.,What will Casey want to do next?,speak positively about her ex,get back together with her ex,press charges against him,C
1630,Jesse helped Addison write their paper and did a good job helping them.,What will Addison want to do next?,finish their paper,get paid for the work,see how Addison did,A
1631,"In their study of 2442 children aged 7 to 11 years, the researchers found that playing video games for one hour per week was associated with better motor skills and higher school achievement scores, but no further benefits were observed in children playing more than two hours each week.",Why did Remy do this?,"especially popular among young adults, a substantial number of older adults play video games as well","spending three hours or more in front of their Nintendo, video games begin to take their toll",Fatigue. Migraines due to intense concentration or eye strain. Carpal tunnel syndrome caused by the overuse of a controller or computer mouse,B
1632,Jordan took Kai to view the beautiful night sky miles away from the city lights.,What will Kai want to do next?,call for help and get assistance,spend time with friend,enjoy the evening alone with Jordan,C
1633,Aubrey changed her hair color frequently because she couldn't decide what color she liked best.,How would you describe Aubrey?,feeling pretty,discontented until she find the right hair color,confused about which hair color she likes,C
1634,lee put their hand to skylar's lips so that they wouldn't make any more noise during the piano recital.,What will happen to Lee?,be quiet during the recital,stay loud,be embarrassed,A
1635,Robin looked like someone and decided to mimic the way they dressed and did their make up.,How would you describe Robin?,pretty,someone who copies others,confident,B
1636,Sydney's mother packed her quite a bit of snacks for school that day.,How would her friends feel as a result?,full after eating dinner,full after eating snacks,loved,B
1637,Carson had always been a disingenuous sort of person. He even bragged he told the truth never.,How would Carson feel afterwards?,good,"bad, he was really nice after all",annoyed with Carson,A
1638,Carson was a very dedicated worker and he did an amazing job.,What does Carson need to do before this?,"get his hair cut, so he looks good for his work",help his boss work on his spreadsheet for some clients,go fishing with his father before it's to late,B
1639,Carson's dog constantly begged them for extra treats when they watched tv.,How would Others feel as a result?,badly,a lover of the tv show Judge Judy,pleased,A
1640,Taylor used glue anyway even though the instructions said to use tape.,How would you describe Taylor?,rebellious,regretful for messing things up,Satisfied that it did work as well,A
1641,Remy was a terrible influence. She took Sasha's happy life and turned it to a life of crime.,What will Sasha want to do next?,be persuasive,ignore her problems,get away from Remy,C
1642,Remy turned Sasha's life to a life of crime because he was a bad person.,Why did Remy do this?,needed to disregard the rules,he cared about her,he was a criminal,C
1643,addison gained kai's confidence so kai was thinking about giving them more responsibility.,What will Kai want to do next?,delegate more tasks,show subject matter mastery,stop trusting addison,A
1644,Quinn went to school to become a lawyer and that's what she did.,What will Others want to do next?,learn about the law,become a legal professional,talk to Quinn,C
1645,Robin determined the grades of all of their students' tests.,How would Robin feel afterwards?,a good person who cares about her students,a school teacher who cares about her job,powerful,B
1646,Jordan finally worked up an appetite and decided to get some lunch.,How would Jordan feel afterwards?,Like getting some lunch,starved,hungry,C
1647,Quinn had seen Robin's brother and she wasn't sure if she should tell Robin about it or not.,How would Quinn feel afterwards?,exhausted,certain,confused,C
1648,Jesse had fun playing piano for a few hours after eating dinner.,Why did Jesse do this?,get ready for bed,make plans to do this again,loved,A
1649,The Kendall rank coefficient is often used as a test statistic in a statistical hypothesis test to establish whether two variables may be regarded as statistically dependent.,Why did Kendall do this?,write a book about the coefficient,"commonly employed to detect monotonic. trends in series of environmental data, climate data or hydrological data",patent the process so he can make money,C
1650,Robin had been friends with him for years and he did a good job of spending time with her.,How would Robin feel afterwards?,upset,robin who has meet their friends to get a good job,excited,C
1651,Kai went up the mountain one day and he seemed larger and heavier at that elevation.,What will Kai want to do next?,Travel to the mountain when ready,take a nap,take a picture,C
1652,Riley lost their wedding ring at the restaurant. Carson returned to the restaurant and found Riley's ring.,How would Carson feel afterwards?,relieved,responsible,a good friend,C
1653,Aubrey gave the children a spanking for misbehaving and they all started crying.,How would you describe Aubrey?,kind,mean,loving,B
1654,Tracy decided to investigate the murder because she was very confused.,What does Tracy need to do before this?,make a plan,read more about the murder,murder someone else,B
1655,Cameron thought something would happen if he started the dancing before anyone else.,What will Cameron want to do next?,wait for the music to start,try to encourage others to dance,leave the party if nobody else dances,B
1656,Kai decided to take their own volition and leave home all by themselves.,How would others react as Kai left?,happy that Kai decided to leave alone,confused as to why Kai left alone,good about Kai going away all alone,B
1657,Bailey got to Skylar's feet and tried to pull her up from the ledge.,What will happen to Bailey?,she will slip,she will die,she will be safe,C
1658,Sasha washed Tracy's car because it was dirty.,What does Sasha need to do before this?,get some rest,keep washing,be a good friend,C
1659,sasha wanted to get warm so she started a campfire in the woods.,What will Others want to do next?,remove a box of matches from her backpack,appreciate sasha,hate sasha,B
1660,A robber had entered the home of Ash.  While they were stealing thing Ash interrupted them and phoned the police.,What will Ash want to do next?,Run away,keep the door closed,open the door and let them free,B
1661,Addison became Alex's agent who was one of the worst people to work for in the business.,What will happen to Alex?,struggle with Alex,have an easy time,be happy with Alex,A
1662,Skylar lost twenty pounds by changing the diet.,How would you describe Skylar?,added fruits and vegetables to the diet,added lots of tortillas and meat to the diet,added strawberry shortcake to the diet,A
1663,Sydney took a cruise to a distant island and had a great time.,What does Sydney need to do before this?,avoid the cruise,plan for the cruise,have new experiences,B
1664,robin had a talk with skylar and skylar gave robin the ability to move forward.,How would Robin feel as a result?,anxious,uptight,calm,C
1665,Jesse recently received her diploma and began to apply to jobs in her industry.,How would Jesse feel afterwards?,Overwhelmed,ambitious,determined,C
1666,Alex was staying in for the night. Alex watched movies online instead.,Why did Alex do this?,get Netflix,wanted to be alone,download a movie,B
1667,Robin was the judge in the final round so Robin determined one's fate.,How would you describe Robin?,'In control,looking forward to seeing all the best talent during the final round of judging,pleased to be chosen for the respectful and powerful judging position,A
1668,Austin knew who robbed Jordan and gave Jordan their names.,What will happen to Jordan?,not listen to Ausin,go to the police,recognize the robbers,B
1669,Alex acted on the anger of his opponent and struck the torso with the palm of his glove after Ash's mistake.,What will Alex want to do next?,let Ash win,prove that all the training was worthwhile,defeat his opponent,C
1670,"Taylor received an answered prayer from the lord, and decided from that day forward to be a believer.",What does Taylor need to do before this?,pray for what they wanted,go to prayer group,go to church,A
1671,Lee was always cold in the winter so she made sure she always wore gloves.,How would you describe Lee?,loves to be in the cold,very cautious,prefers for it to be warm,C
1672,Riley told Carson to give them the knife so that they could demonstrate proper carving techniques.,How would you describe Riley?,like a knife giver,useless,kind,C
1673,Jordan wore their own clothes instead of the uniform that was required by their school.,Why did Jordan do this?,show off the new clothes,inform the school that the uniform was unaffordable,show slight defiant,C
1674,Sasha worked at a store and was in charge of assisting customers.,What will happen to Kendall?,go to work,be annoyed,be dutiful,C
1675,Lee had high blood pressure. Lee ate a bunch of salty food that increased their blood pressure.,How would Lee feel afterwards?,like they should eat more,sick because of the effects of the food,joy about eating the salty food,B
1676,Jordan was a hard working tailor with many clients and always fitted the clothes best.,How would you describe Jordan?,someone who cares about his services,someone who cares a lot about clients,very proud of their sewing talent,B
1677,Riley took horseback riding lessons.  They became good at riding horses.,How would Riley feel afterwards?,feeling proud,like congratulating themselves,the need to improve,A
1678,"Addison used the book to describe history, since it was full of some great examples.",What does Addison need to do before this?,have someone to describe it to,get the math book,read the book,C
1679,Riley went shopping with Cameron for a new suit for his interview.,What will Cameron want to do next?,help Cameron select a tie,buy a new suit,get an old suit tailored,B
1680,"As their friend had just moved, Skylar brought a gift to their house.",How would you describe Skylar?,Happy,a good friend,selfish,B
1681,"Bailey was the Head Usher at church, which she loved. She got sick and missed church for a month, and when she got back, Taylor had taken her place.",How would Bailey feel afterwards?,sad,someone who enjoys what she does,someone who cares about her job,A
1682,Robin was the new delivery driver and Robin delivered the package to Kendall's address.,What will Kendall want to do next?,Get the package,Make a paycheck,Mail the package,A
1683,Austin set an alarm at variance just in case he didn't hear the first alarm.,What will Others want to do after?,continue to sleep,cut the alarm off,go to sleep,B
1684,Tracy punched Quin. Tracy made Quinn sad.,How would you describe Tracy?,wanting to make Quin sad,wanting to go to sleep,ashamed,A
1685,Bailey helped Taylor move into their new home in the city.,How would Bailey feel afterwards?,they want the house,a person who supports Taylor's move into the new home,they helped Taylor,C
1686,Riley beat around the bush when asked questions about the crimes she might've committed.,What will Riley want to do next?,avoid being hated,reconcile with the interviewer,lie more,C
1687,Ash prevented the door from moving by placing a desk behind the door to keep the intruders out.,What does Ash need to do before this?,break the desk,unlock the door,move the desk,C
1688,Cameron was blind and their guide dog was unwell so Riley took Cameron out and Riley directed Cameron's stepsl.,How would Cameron feel as a result?,helpful,safe,unsupported,B
1689,"Ash was working outside today and she heard a noise close to the trash, she went look and saw something tiny and cute. Ash found another cat.",What does Ash need to do before this?,pet the cat,look at the cat,go to work,B
1690,Jan found Cameron's missing ball that he had been looking all over for.,What will Cameron want to do next?,find out that the ball was missing,steal it,take the ball,C
1691,Remy failed his class about literature when he was a freshman in college.,What does Remy need to do before this?,show up late,work harder to pass literature,work hard at school,A
1692,Jesse was mad at Jan so he left her alone in the house.,Why did jesse do this?,be rude,forgive jan,be loving,A
1693,Lee meant to throw the ball to people but threw a ball to the dog by mistake.,What will Lee want to do next?,good,lazy,bored,A
1694,Sasha told Addison she would let her know about going to the dance in a minute.,What will Addison want to do next?,Know where the dance is,Know what time the dance is,bug Sasha for an answer,C
1695,Jan had had enough taunting and on that particular Thursday she grabbed Riley by the hair.,Why did Jan do this?,had smacked Jan,get away from Jan quickly,was a bullying Jan,C
1696,Quinn bought a brand new replacement for her bedroom and the lamp worked great.,What does Quinn need to do before this?,go to the store,go to a pumpkin patch,have a new lamp in the bedroom,A
1697,Alex and them practiced together while Jim sat on the bench.,How would you describe Alex?,a slow person,like a good teacher,a strong person,B
1698,Jesse met their husband at the restaurant and had a great meal with them.,How would Others feel as a result?,bored,Like a good wife,romantic,C
1699,Alex took Casey in their arms after picking them up from the airport.,How would Alex feel afterwards?,anxious,happy,nervous,B
1700,Jesse came to see Sasha at their play performance at school.,How would you describe Jesse?,happy,Sasha's parent,supporting Sasha,C
1701,"Lee did not like winter, and did not want to be cold, Lee put on gloves, but they only helped a little bit.",How would Lee feel afterwards?,not prepared,was excited about winter,"felt okay, he was warmer",A
1702,Remy told everyone about the fight. Remy also saw the fight.,How would you describe Remy?,a person who hates talking,a person who likes to gossip,scared,B
1703,Sasha went to the party and told others that she was having a baby soon.,What will happen to Sasha?,go to bed,she will have a baby,be congratulated,C
1704,Addison became Alex's agent by being the best agent in the world at the time.,What will happen to Addison?,lazy,be well promoted,smart,B
1705,Jesse called out immediately for help when the office machine began to fall.,What will other workers want to do next?,stop the machine from falling on him,help Jesse,drop the machine,B
1706,Austin helped another person with their homework after a long day.,What will Others want to do next?,go home,try harder,ignore him,A
1707,Bailey told Quinn that they wanted to go on a date with them.,How would Bailey feel afterwards?,insane,romantic,nervous,C
1708,Cameron went shopping at the mall for a new pair of shoes.,How would you describe Cameron?,likes to go grocery shopping,likes to buy shoes,excited,B
1709,Alex was in a hurry because she was running late and ended up spilling Riley's coffee.,How would Alex feel afterwards?,angry,clumsy,happy,B
1710,Tracy remained friends with the person that everyone really hated in school.,What will happen to others?,be hated,not like tracy,like tracy more,B
1711,Ash arched Aubrey's body and threw it in the relay race to try to get ahead.,What will Ash want to do next?,control Aubrey,yell at Aubrey,win the race,C
1712,quinn was a warrior fighting for the king so she spilled the bandits' guts.,What will Others want to do next?,resent quinn,appreciate quinn,hate quinn,B
1713,Remy asked if they could ride in the front of the car with their dad.,What will Others want to do next?,go to bed,let them ride up front,get in the car,B
1714,Quinn devoted her free time to the service at the church for a few hours each week.,What will Others want to do next?,lazy,loved,bored,B
1715,Jesse called the school immediately to tell them he was sick.,What will Jesse want to do next?,take Jesse to the hospital,take Jesse to the doctors,stay home,C
1716,Kendall knew no bounds when it came to driving recklessly.,How would you describe Kendall?,Careful,well-intentioned,Inconsiderate at the last,C
1717,"At the lively party with all of their friends, Jesse had tons of fun.",How would you describe Jesse?,silly,out-going,felt satisfied,B
1718,Kendall knew no bounds outside since she'd been raised by busy parents.,Why did Kendall do this?,run wild on the city streets,settle down and start a family,be rebellious,C
1719,Robin made friendship bracelets out of silver and gold in a few hours.,How would Robin feel afterwards?,lazy,bored,loved,C
1720,The cancer diagnosis they received was very disheartening at first but after they pulled themself together Taylor knew they would beat it.,What does Taylor need to do before this?,keep all her doctor appointments,see if things got worse,be confident,C
1721,"Tracy slept awkwardly on their new bed and was having some pain, so Tracy craned their neck.",What will Tracy want to do next?,sleep in the same position,crack her neck,good,B
1722,"Tracy was getting ready for the celebration. Tracy was just waiting on bread, so Tracy put bread in the oven to set up the table.",What will Tracy want to do next?,put the bread in the oven,know how to bake bread,set the table up,C
1723,Remy spent all his free time on video games instead of working on their homework.,Why did Remy do this?,were ambitious,were irresponsible,wanted to excel,B
1724,Jordan was on a date with Bailey. It was cold out and Jordan wrapped their arm around Bailey.,How would Jordan feel afterwards?,confused,loved,warm,B
1725,Skylar gave Robin the ability to move forward by offering a job opportunity.,What will happen to Skylar?,may get a change in her pay,hire Robin,have a chance to further her career,B
1726,Jordan had a hard time answering the questions so he formed Addison's opinion as his own.,How would you describe Jordan?,smart and eager to learn,hardworking and determined,unable to think for himself,C
1727,Alex went to the doctor for a terrible cough he's had for a week.,How would Alex feel afterwards?,glad to have water,sicker,glad to have medicine,C
1728,Tracy was trying to get a good look so she craned to see Carson's neck.,How would you describe Tracy?,curious,interested,concerned,A
1729,Carson carefully reviewed all the evidence that was put together.,What does Carson need to do before this?,consider all the facts,prepare for the upcoming litigation,prepare for the upcoming trial,C
1730,"Summarize the variables that lead to initial attraction between people. Outline the variables that lead us to perceive someone as physically attractive, and explain why physical attractiveness is so important in liking.",Why did Bailey do this?,"a large literature on the variables that lead us to like others in our initial interactions with them, and we’ll review the most important findings here (Sprecher, Wenzel, & Harvey, 2008)","family members, and other people in general, and although our analysis can apply to these relationships as well, our primary focus in this chapter will be on romantic attraction, whether in opposite-sex or same-sex relationships","When we say that we like or love someone, we are experiencing interpersonal attraction—the strength of our liking or loving for another person. Although interpersonal attraction occurs between friends,",C
1731,Lee went to the University to obtain a college degree.,What does Lee need to do before this?,learn how to read,learn how to knit,Become a teacher,A
1732,Jan's cat did not seem to like Jesse.,What will Jan want to do next?,take their cat to the vet,spoil their cat,pet the cat,C
1733,Sydney shared lunch with their friends and they chatted about school and memories.,How would Others feel as a result?,VERY FRIENDLY,nostalgic,VERY KIND,B
1734,Tracy saw they were running low on money and bought Quinn's item for them.,How would you describe Tracy?,a helpful person,a stingy shopper,grateful,A
1735,Sasha beat her brother easily when they were playing soccer.,How would you describe Sasha?,incompetent,strong,lazy,B
1736,riley asked their boss for a raise and got it even though others had been denied.,How would Others feel as a result?,angry with their boss,successful for being given more,happy with their boss,A
1737,Riley was a mechanic who was hired by Lee. Riley replaced Lee's tire.,How would Lee feel as a result?,like they could drive a long ways,accomplished,hardworking,A
1738,Taylor took the newspaper to read and it had a good joke section for that day.,Why did Taylor do this?,in awe,continue reading the joke sections,finish reading the rest of the paper,C
1739,Tracy bought a computer with the money he saved.,Why did Tracy do this?,wanted to go on the internet,bank some money,wanted to play solitaire games,A
1740,"Addison waited for Sasha to answer the phone, but Sasha would not pick up.",What does Addison need to do before this?,Send her a text message,call Sasha a few times in a row,type Sasha's phone number in,C
1741,Jesse believed in Carson also and donated a lot of money to his cause.,What does Jesse need to do before this?,reject Carson,write a check,abandon Carson,B
1742,Sasha had a perfect score in all her classes because she cheated on every test.,How would you describe Sasha?,dishonest,a cheater,fair,B
1743,Skylar gave Robin the ability to eat when she invented a new spoon.,What will Skylar want to do next?,patent her invention,give up inventing,abandon Robin,A
1744,Jordan worked hard to get the degree at college.,How would Jordan feel afterwards?,committed,Very academically inclined,incompetent,A
1745,Ash swung Aubrey's legs over his head as part of the dance.,What will Ash want to do next?,hold on to her as they dance,suplex her into the ground,throw her around the room,A
1746,Aubrey quickly went to the store to pick up the milk that they needed to finish making dinner.,What does Aubrey need to do before this?,not have enough milk,finish cooking dinner,dump out the old milk,A
1747,Others mentioned that they like pizza. Kai also said that they like pizza.,What will Others want to do next?,mention pizza again,ask Kai about their likes,try pizza,C
1748,aubrey was the babysitter and she did not like it so she spanked the children for misbehaving.,How would Others feel as a result?,as content,a bad babysitter,not good with kids,C
1749,Addison saw Quinn's crush with another woman at the game.,What will happen to Addison?,be devastated,be heartbroken,need to tell Quinn what she saw,C
1750,Jan waved his hands around so his friends could spot him in the crowd.,How would Others feel as a result of this?,happy to see Jan,annoyed with Jan,ready to fight Jan,A
1751,Carson told his teacher he had never been to the zoo before.,What will Carson want to do next?,Build a zoo,Ask about the zoo,get taken to the zoo,C
1752,"Sasha and her sister had races frequently, Sasha beat her sister easily.",Why did Sasha do this?,let her sister win,prove she was fastest,needed to eat healthy,B
1753,Robin determined one's fortune by choosing the winner and loser of the game show.,What will contestants want to do next?,be appointed to be the game judge,win Robin's favour,anger Robin,B
1754,Addison suited Kai's purposes and was offered the job and benefits.,How would Addison feel afterwards?,grateful afterwards,was right for the job,was a qualified candidate,A
