,context,question,answerA,answerB,answerC,correct
0,bailey was a nice person so she called the family together.,What will happen to Others?,talk to the family,hate bailey,thank bailey,C
1,Alex found a ring on the beach and tried to find who it belonged to.,What will the person who lost want to do next?,throw it in the ocean,turn it into lost and found,leave the beach,B
2,Quinn player with remy swinging her around and she laughed and asked for more.,What will Quinn want to do next?,be friendly with Remy,have the trust of Remy,Put Remy down,C
3,Casey was popular throughout high school. Casey was a star football player there.,How would you describe Casey?,a lazy person,casey who has a star of football player,a social person,C
4,Alex bumped the table that the coffee was placed on.,What will happen to Riley?,continue to drink the coffee,spill the coffee,have to buy a refill,B
5,Robin took Taylor's laptop in for repair and cleaning.,What will happen to Taylor?,pay the bill for the repair and cleaning,useless,supported,A
6,Ash was still angry at his mother for making his sandwich without mustard.,How would you describe Ash?,mustardless,petty,sweet,B
7,Quinn spilt their guts with his raucous jokes and good humor.,How would you describe Quinn?,a very serious person,a very funny person,a very sullen person,B
8,Kendall saw their crush standing at the movie theater.,How would Kendall feel afterwards?,embarassed,very shy,like she wanted to talk,B
9,Kai's girlfriend loved to travel all over. Kai also liked travelling so they did it together.,Why did Kai do this?,wanted to have new experiences,wanted to have old memories,Be happy for them,A
10,Janbought a cat at the pet store and brought it home with them.,What will happen to Jan?,form a bond with the cat,buy a turtle,take care of their cat,A
11,"Casey was using Riley's lip balm, than put it back in her purse.",What does Casey need to do before this?,purchase new lip balm,ask Riley if she could borrow it,steal it from Riley,B
12,Taylor played dodgeball with a group of friends at school.,How would Others feel as a result?,heartbroken,sociable,upset,B
13,Jordan had a test that she needed to study for tomorrow.,How would you describe Jordan?,a student,smart,a college dropout,A
14,"Robin had been friends with him for years, and wanted to do something special for his birthday.",What will Robin want to do next?,Gather friends,Buy a card with a short note inside,Call him and wish a happy birthday,A
15,Jordan took a football outside to play with their friends.,What does Jordan need to do before this?,play football,buy a football,go outside,B
16,riley saved their people from an oppressive regime and installed a new leader.,What will happen to Others?,become an adviser,be angry at riley,be saved,C
17,tracy was a protective mother so she shielded aubrey's eyes.,What will happen to Aubrey?,hide Aubrey from the shocking sight,continue to protect Aubrey from the scary sight,he will thank tracy,C
18,Addison tried with all their might but they couldn't lift the large boulder from their father's leg.,What will Addison want to do next?,keep their father calm,watch the boulder crush his leg,call the police,C
19,"Kendall felt the lump inside Jesse, and told Jesse they needed to be tested for cancer.",How would Kendall feel afterwards?,worried that Jesse might have gas,determined to find out what's going on with Kendall,worried that Jesse might have cancer,C
20,Jesse called the school immediately to make a complaint with the principal.,What will the school want to do next?,Expel all of the students,Buy a phone from the store,Be apologetic to Jesse,C
21,Robin blew this popsicle stand. It wasn;t as fun as she had hoped it would be.,How would you describe Robin?,thrill seeking,stay longer,indifferent,A
22,Tracy craned her neck around quickly to see the bird fly past.,What will happen to Tracy?,do neck exercises,see a car driving by,see the bird flying overhead,C
23,Casey came to light about what had happened at school.,What does Casey need to do before this?,lie to others,be honest,investigate more,C
24,"Bailey liked to house-sit as a side job, so when her friend went on vacation Bailey took on Taylor's place.",What will happen to Bailey?,strong,watch over Taylor's house,proud,B
25,tracy needed to talk to addison so she walked behind him.,What will happen to Addison?,catch up to Addison,he will turn around,he will ignore tracy,B
26,Riley beat around the bush because he wanted to stall.,Why did Riley do this?,make a decision,understand the situation,be nice,B
27,Quinn was having a talk with their significant other. Quinn poured their heart out.,How would Others feel as a result?,relieved,ignored,better,C
28,Quinn was fishing in the bay with her father and pulled the fish out of the water.,Why did Quinn do this?,catch the fish,save the fish from drowning,put the fish on ice,A
29,Lee put their lips onto Skylar's lips during the movie.,Why did Lee do this?,kiss Skylar,kiss back,ignore the movie,A
30,Bailey works at a health spa that works on people's bodies to pamper them.,What will happen to Skylar?,freak out,upset,have their nails painted,C
31,Jesse published notes in journals and caught her sister reading them when she walked in.,What will happen to Jesse?,violated,be mad,be angry,B
32,Addison walked to their room and regretted getting grounded for a month.,How would Addison feel afterwards?,sorry for themselves,like slamming their room door,like rebelling against authority,A
33,Carson finally got back from the park that day.,How would Carson feel afterwards?,like she had fun,exhausted,lonely,A
34,"Addison called the others the next day, after missing their call initially.",What will happen to the others?,pick up the phone,be unwilling to answer,wonder who Addison is,A
35,"Bailey was playing in the ocean at the beach, but Bailey started to sink.",What will Bailey want to do next?,ignore the lifeguard,stop trying to swim,signal a lifeguard,C
36,"Jesse bought a new Ford Mustang. On his way home he blew through town going as fast as he could, almost getting a ticket.",What did Jesse do?,nervous,bought a new car,sold his old station wagon,B
37,Riley saw Cameron walk away from school even though school was in session.,What will Cameron want to do next?,go to the mall,chase after Cameron,tell the teacher,A
38,"Tracy wants to make a special dinner tonight, so they went shopping today.",Why did Tracy do this?,buy ingredients for dinner,buy new clothes for a date,put the food away,A
39,Jordan looked like a new person after losing a lot of weight.,What does Jordan need to do before this?,exercise a lot,eat many foods,stop eating,A
40,Casey brought the truth to light about where they went last night.,How would Casey feel afterwards?,like a liar,honest,upset,B
41,Sasha beat her sister easily since she was 10 years older.,What will happen to Sasha?,stay better than her sister,keep beating her sister,get confident,B
42,Tracy talked on the phone all night with Beth and stayed up late.,Why did Tracy do this?,rebel against her parents' bedtime,play games on the new phone app,keep having fun with Beth on the phone,C
43,Taylor got sick on Tuesday and was unable to perform in the play.,What will Taylor want to do next?,thank Bailey for helping out,thank Jenna for helping them out,be happy they were unable to go,B
44,"Aubrey saw every person who walked into her store that day, but the man who forgot his glasses yesterday never showed up.",What will Aubrey want to do next?,try and find the man,call the police,send an email to her coworker,A
45,Casey found a friend to play with while she was on school vacation.,What will Casey want to do next?,ignore the friend,meet the friend,stay at home,B
46,Aubrey went to the store to get some shampoo for her shower in the morning.,What will Aubrey want to do next?,buy a roast chicken,leave the house,get a good deal,C
47,Sydney left Jesse after a time and returned home to eat food.,How would Jesse feel as a result?,very loved,quite alone,someone who sticks to routine,B
48,Remy wanted to help out people who were less fortunate than them.,What will Others want to do next?,refuse help,do the same,be helpful,B
49,Casey was refusing Addison's request to go to the dance on Friday.,What does Addison need to do before this?,laugh to get out of it,beg Chase to go,cry to get her way,B
50,Bailey helped Taylor move into their new apartment in the city.,Why did Bailey do this?,start looking for a job,move Taylor in,decorate the apartment,B
51,Jesse called out immediately for help from other workers when a machine fell on their foot.,How would other workers feel as a result?,concern for Jesse,happy for Jesse,as kind,A
52,Addison twisted Casey's arm into going out for a drink after work.,What will happen to Casey?,drink at home,enjoying going out,go for dessert,B
53,Ash missed work due to being sick but did not bother to place a call saying they would not be in.,How would you describe Ash?,a considerate person,a poor employee,remorseful about inconveniencing their boss,B
54,Austin spent their time reading because they had nothing else to do.,What will Austin want to do next?,study,sleep,eat,B
55,Remy was a web developer at a well respected consulting firm.,What does Remy need to do before this?,Go to college,Drop out of high school,wanted to be successful,A
56,Lee sold a TV on Craigslist for a great price.,What will Others want to do next?,make some extra money to see Lady Gaga,make money to help out his family,buy the TV,C
57,After struggling with the game for several months Taylor beat it.,What will Taylor want to do next?,start the level over again,try again to beat it,start a new game,C
58,Tracy refused to recycle and save energy to help protect the Earth.,How would you describe Tracy?,important to change habits,ashamed,guilty,C
59,"Remy took their laptop everywhere, but eventually forgot it on a bus.",What does Remy need to do before this?,take the laptop on a bus,take the laptop to the kitchen,study,A
60,Remy gave more money to the charity after they received their paycheck.,What will Remy want to do next?,support the charity,be a helpful person,donate all their money,A
61,"The meet was supposed to be the hardest yet, but Sasha beat the record easily.",What will happen to Sasha?,be awarded,try to beat Sasha,lose her trophy,A
62,Riley saved their people a lot of time at work by implementing a new software solution.,How would Riley feel afterwards?,intelligent,ineffective,incompetent,A
63,Quinn applied for a job at a new company. Quinn hoped he would get it.,What does Quinn need to do before this?,call the company and yell at them,wait and in the meantime email other companies,find the new job that he wanted to get,C
64,Alex acted on Ash's anger and smashed the delicate china bowl.,How would Alex feel afterwards?,calm yet hurt with Ash,strong and empowered,regretful they broke the bowl,C
65,Alex goes over the song a few times with the class. Alex takes time to practice with them over and over.,What will Alex want to do next?,give them a test on the song,make them practice a new song,have them learn a new song,A
66,Kendall contained Sasha's number in their phone and never deleted it after getting a new one.,What will happen to Sasha?,be known,be famous,be refreshed,A
67,There was a woman's movement to take legislation to the courts.,What does Aubrey need to do before this?,want change,Join the movement,join the army,B
68,Taylor went to church and told the priest that he needed to be forgiven for sins.,What does Taylor need to do before this?,repent,find a chuech,be rude,B
69,Bailey spent time at Alex's house every chance they could get.,What will happen to Alex?,needed,become close to Alex,become like family,C
70,Bailey spent a lot of time together with their friends at the beach house that summer.,What does Bailey need to do before this?,Drink beers,buy a beach house,go to the beach,C
71,"Remy was Kai's favorite cow so when he died, Kai tanned Remy's hide.",Why did Kai do this?,thought the hide would look nice by the fireplace,wear the hide as a Halloween costume next October,"see if it would taste good, like beef jerky",A
72,Bailey took matters into their hands and got the whole place decorated for the party.,How would Bailey feel afterwards?,happy to make the cake look beautiful,pleased that the party would be good,pleased that the punch would be good,B
73,Skylar was trying to get a leaf from Jordan's head so they shook Jordan's head.,How would you describe Skylar?,lpful,rude,Abusive,B
74,Lee Murdered the person that was hurting Austin because he loved Austin with all his heart.,Why did Lee do this?,cared for Austin,hated Austin,wanted Austin to be hurt,A
75,Alex acted on Ash's best interest when they told the teacher what happened.,What does Alex need to do before this?,explain what happened to Ash,doing,know their best interest,A
76,The team needed a name and they asked Jesse since he was the captain.,What will the team want to do next?,win games!,lose games!,make a banner with their picture,A
77,Cameron made perfect grades and made the principals list because of it.,How would Cameron feel afterwards?,lucky,intelligent,would be ill-conceived,B
78,"Even though Kendall had promised to help, when the time came, Kendall leaved Jan high and dry.",What will Jan want to do next?,spend more time with them,avoid Kendall entirely,untrustworthy,B
79,Lee visited their mother illegally who was a fugitive on the run from the law.,What will happen to Lee?,become an accomplice,not put themselves in that kind of danger,report their mothers where abouts to law enforcement,A
80,Ash was raising her kids alone and people thought she wasn't doing well. Ash was a good mother to the two young kids.,What will Ash want to do next?,was loving,keep watching parents,do her best,C
81,"Typical of every four months, Alex went to the doctor for a routine checkup and was told he needs rest.",What will Alex want to do next?,call the doctor,Finish all his projects and postpone the rest,Take time off work,C
82,Sydney made Skylar's connection and got to talk to her mother.,Why did Sydney do this?,Take them out,loved,Take them to eat,A
83,Alex took Casey in her arms who was his long term girlfriend and partner who just reunited.,Why did Alex do this?,missed Casey,give Casey a long kiss,hug Casey for a long time,A
84,Quinn pulled the car over for speeding on the road.,How would you describe Quinn?,lackadaisical,an enforcer,uncaring,B
85,Tracy was beginning a research paper and borrowed a thesis for use.,What does Tracy need to do before this?,go to class,go to the ball field,ask to use it,C
86,Robin thought Taylor was spending too much time on their laptop. Robin took Taylor's laptop.,What will Taylor want to do next?,be capable of seizing the laptop,give the laptop to Robin,get upset at Robin,C
87,Austin ran right to the store after finding out the new video game had released.,Why did Austin do this?,save money,spend their money,play the new video game,C
88,Kendall had some customers who attended the conference. Sasha met Kendall's customers at the conference.,What will happen to Sasha?,be introduced,be dismissed,she will meet them,A
89,Quinn came out of the doctor looking very sad and depressed. Sasha was there to pick him up.,What will happen to Sasha?,ask him about his results,yell at him,wrong,A
90,Casey made her lunch quickly when she got home from work.,What does Casey need to do before this?,go to her house,eat while working,eat the lunch,A
91,"sasha promised robert she would bring his homework, but she forgot it.",How would you describe Sasha?,as careless,as smart,shasha who has promised robert,A
92,Bailey had a major project due in her American History class at school and she worked very hard on it.,How would Bailey feel afterwards?,very hardworking studious,like she had forgotten an important task,like she accomplished something important,C
93,Robin managed their team at work well and completed all the tasks on time.,What does Robin need to do before this?,be rewarded next,be in charge,start a business,B
94,"After thinking about asking out Becky for weeks, Austin finally worked up the courage and they became a couple by the end of the week.",How would Austin feel afterwards?,embarrassed and sad,someone who can overcome his fears,happy they took a chance,C
95,Sydney gave Ash a bit of advice about fishing off of the bridge.,How would Ash feel as a result?,very angry,very informed,knowledgeable about fishing,C
96,Robin was a pro at eating Chinese food and taught them how to use chopsticks.,What will Others want to do next?,learn quickly,like Chinese food,spit out food,A
97,"Ash took their laptop to be repaired, but the store couldn't do anything about it.",How would Ash feel afterwards?,sorry,frustrated afterwards,useless afterwards,B
98,To all of her friends' surprise when they asked her to speak Quinn spoke Japanese fluently.,Why did Quinn do this?,seem like she was Japanese,be a showoff,surprise her friends,C
99,Skylar bought lunch the other day for his friend at their favorite restaurant.,How would you describe Skylar?,As nice,friendly,As talkative,A
100,Jesse took off Sasha's coat because it was getting too warm in the room.,Why did Jesse do this?,talk to Jesse,bored,good,C
101,Quinn dropped the leaf out of Sydney's book that she was using as a book marker.,What will Quinn want to do next?,throw the leaf away,put it back in the book,get a new leaf,B
102,Lee put their hand to Skylar's lips because Lee wanted Skylar to stop talking immediately.,How would Skylar feel as a result?,supported by Lee,insulted by Lee,someone who does as they please,B
103,Sasha sent Taylor home after they complained of being sick at work.,How would Taylor feel as a result?,like going home,sick,like a liar,B
104,Tracy visited Cameron's mother in the home for the elderly and brought them some snacks.,Why did Tracy do this?,eat,make sure Cameron's mother wasn't lonely,talk,B
105,Casey took it everywhere with Robin because she didn't want to lose it.,Why did Casey do this?,she cared for it,she didn't want it,she wanted to lose it,A
106,Cameron arrived home and found that no one was inside the house.,What will Cameron want to do next?,enter the house,steal from the house,rob the house,A
107,Sasha met Kendall's customers at the conference and stole their business.,What will happen to Kendall when this happens?,increase her staff to take on the new business,meet with her customers to fulfill their needs,lose customers,C
108,The place was too crowded to sit down so Tracy found another place to go.,What will Tracy want to do next?,go to work,go home,find a place to sit,C
109,Austin held the tape securely in place while dad took a measurement of the room.,What will Austin want to do next?,lp his dad with the room,Leave his dad to work alone,snap closed,A
110,Kai noticed everyone was invited to the party and wanted to come too.,How is Kai feeling?,left out,unwanted,feeling curious to go,A
111,Quinn surmounted every obstacle in her college career.,How would Quinn feel afterwards?,smart,very lazy,like a success,C
112,Lee just got out of prison for assaulting Kai. Lee saw Kai this afternoon.,How would Kai feel as a result?,happy for him,terrified of him,proud of him,B
113,"Jesse had many talents, but he refused to work any job.",Why did Jesse do this?,teach others his talents,leech off of the system,find a job he likes,B
114,Addison purchased the tickets at a high price right before the show started and rushed in.,What does Addison need to do before this?,ask Becky to hold her place in line,get free tickets for the show next week,quickly get tickets before they sold out,C
115,Cameron met Kendall's husband who had all the qualities that Cameron was looking for in a man.,How would Cameron feel afterwards?,happy for Kendall,longing,angry at Kendall,B
116,"Tracy was always the type who liked to party, she was excited it was her birthday, and invited people to her house.",Why did Tracy do this?,loved the party scene,socialize,was not the party girl,B
117,Bailey used his hands to communicate to the people about his results on the test.,How would you describe Bailey?,feeling loved,excited about the passing grade,feeling bored,B
118,Lee has been away at college for the past 6 months without being able to take vacation. Lee finnally got a weekend off from school and work. Lee decided to visit their mother.,Why did Lee do this?,take her to dinner,help her around the house with home improvement repairs,see the family,C
119,"CArson was not home and Tracy was bored, so Tracy put Carson's puzzle together.",How would Tracy feel afterwards?,Proud,Scared,Shocked,A
120,"Due to his love for the animal, Ash prevented his dog from moving.",How would you describe Ash?,loves preventing dogs from moving,sad,keep his pet,C
121,Cameron bowed their heads in shame after losing the match by a lot.,What will Cameron want to do next?,bored,lose the match,proud,C
122,Austin helped another team mate because the guy needed the help.,How would Others feel as a result?,amazed,envious,neglected,B
123,Ryley was unaware that her cuts had baited them out.,How would you describe Riley?,Happy,like a sorry person,Shocked,C
124,Sydney went camping with a good friend of theirs and had fun.,What will Sydney want to do next?,repair a window,sleep in a tent,buy a cell phone,B
125,"Tracy new Cameron's mother was in the hospital, so one day she visited.",How would Tracy feel afterwards?,considerate,felt sad to see her in bad shape,felt happy she was hospitalized,B
126,Austin helped another family when they were in need.,What does Austin need to do before this?,check up on the family,get close to the family,make a plan,A
127,Quinn spoke Spanish fluently and communicated on behalf of those that didn't.,How would you describe Quinn?,happy,accomplished,help more next,B
128,"When Remy told Sasha that they would be moving to another country, Sasha felt like Remy had turned her life upside down.",What will happen to Remy?,resent Sasha's attitude,miss Remy,try and make Sasha excited about the move,C
129,Aubrey's face turned red after they choked on a piece of the chicken.,What will Aubrey want to do next?,tell the waiter to bring the check,do the maneuver on their own self,do the hokey pokey and turn around,B
130,Addison called their bank the next day to find out what happened to the desposit.,What will Addison want to do next?,go to the bank in person,complain to the bank,get the money,C
131,Lee left Taylor's car in the repair shop overnight so that it could get repaired.,What will Lee want to do next?,do Taylor a favor,pick up the car in the morning,return the car to Taylor,B
132,"Riley worked hard to make a cake for the job party later today, he knows everyone likes cake at the office.",How would Others feel as a result?,The others will be bored out by the idea,thoughtful,happy,C
133,Aubrey's birthday was approaching and Cameron decided to surprise them.,What will Aubrey want to do next?,hug Cameron,spit at Cameron,Plan a party,C
134,Ash thanked Aubrey's father profusely for all of the help and guidance that he had provided.,How would you describe Ash?,unappreciative,appreciative,thankful for all the help and guidance Aubrey's father gave,B
135,People invited Kai because he would be fun at a party due to his energy.,How would Others feel as a result?,that they had fun,regretting inviting Kai,that they were bored,A
136,Jordan started a band with his friends and had a good time making songs.,How would you describe Jordan?,feeling lazy,like the time was well spent,feeling proud,C
137,Bailey went back again for seconds at dinner because the food was good.,What does Bailey need to do before this?,of eaten some,of asked for some,talk about food,A
138,Every Friday Marcus Theatres® has special admission prices for anyone age 60 and over. Come and enjoy a movie at any Marcus Theatres® with our Young at Heart® special – only $6.00 for any show that starts before 5:30 PM. Additional charges apply for 3D features.,What does Addison need to do before this?,5 Tuesdays discounts also extend to concessions! AMC Stubs members can also get cheap easts with a $5 Cameo Combo (cameo sized fountain drink and popcorn),"at any AMC or AMC CLASSIC® theatres, or a $10 Flatbread at participating AMC DINE-IN™ theatres. ... The $5 Tuesday discount applies to showtimes on Tuesdays only","No children 6 and under are allowed into a ""R"" rated movie",A
139,"Jesse was really hoping to write books, but hadn't made it yet, so Jesse published articles in journals.",How would you describe Jesse?,skilled,Goal-oriented,Lazy,B
140,Tracy included another hint so he knew what to buy her.,What will Tracy want to do next?,mention the first hint,ignore him,show him what to buy,A
141,Aubrey took some money from her parents and bought some lunch with it.,How would you describe Aubrey?,full,selfish,honest,B
142,Lee was not focused on the task. Quin caught Lee's attention.,Why did Quinn do this?,talk to Lee,help distract Lee,get Lee on task,C
143,Robined determined their fortune was to do their best.,Why did Robin do this?,proud,decide how to do it,lucky,B
144,Robin gave the children candy but it wasn't the good kind.,What will the children want to do next?,hit Robin,go to another house,convince the children to accept the candy,B
145,"Carson has always been known for being a liar, he never tells the truth.",What will Others want to do next?,be hopeful for Carson's change,Ignore Carson,tell lies,B
146,Kai painted the town red that day and had a lot of fun.,What does Kai need to do before this?,ask about fun,have fun,live in town,C
147,Quinn could jump very high and easily got a slam dunk.,How would Others feel as a result?,as accomplished,annoyed by Quinn,entertained by Quinn,C
148,addison had a secret to keep but told my friend.,How would you describe Addison?,nice,kind,annoying,C
